{
  "apiVersion": "hosting.lowerduckpond.net/v1alpha1",
  "kind": "ArchiveConstructionIntent",
  "intentId": "0198d17f-6f4a-7000-8000-000000000004",
  "uploadAttemptId": "0198d17f-6f4a-7000-8000-000000000003",
  "jobId": "0198d17f-6f4a-7000-8000-000000000002",
  "operatorPrincipal": "operator@example.test",
  "tenantId": "0191e2c4-8f7a-7c3b-8d1e-5f62047a2100",
  "correlationId": "0198d17f-6f4a-7000-8000-000000000001",
  "sourceManifestDigest": {
    "format": "lowerduckpond-manifest-v1",
    "algorithm": "sha256",
    "value": "aaaaaaaaaaaaaaaaaaaaaaaaaaaaaaaaaaaaaaaaaaaaaaaaaaaaaaaaaaaaaaaa"
  },
  "candidateManifestDigest": {
    "format": "lowerduckpond-manifest-v1",
    "algorithm": "sha256",
    "value": "bbbbbbbbbbbbbbbbbbbbbbbbbbbbbbbbbbbbbbbbbbbbbbbbbbbbbbbbbbbbbbbb"
  },
  "deploymentRecordDigest": {
    "format": "lowerduckpond-deployment-record-v1",
    "algorithm": "sha256",
    "value": "cccccccccccccccccccccccccccccccccccccccccccccccccccccccccccccccc"
  },
  "releaseTreeDigest": {
    "format": "lowerduckpond-release-tree-v1",
    "algorithm": "sha256",
    "value": "dddddddddddddddddddddddddddddddddddddddddddddddddddddddddddddddd"
  },
  "bundleSha256": "eeeeeeeeeeeeeeeeeeeeeeeeeeeeeeeeeeeeeeeeeeeeeeeeeeeeeeeeeeeeeeee",
  "bundleSize": 4096,
  "bucket": "lowerduckpond-net-production-tenant-archives-4f3e6b91",
  "key": "archives/0198d17f-6f4a-7000-8000-000000000003.zip",
  "versionId": "3LgY0Q5G-safe-fixture-version",
  "phase": "uploaded",
  "createdAt": "2026-08-29T12:01:00Z"
}
